{
  "schema_version": "1.0.0",
  "generated_at": "2026-04-10T19:47:13.231Z",
  "energy": {
    "energy_level": 75,
    "mental_load": 3,
    "sleep_quality": 4,
    "burnout_risk": false,
    "red_alert_active": false
  },
  "finance": {
    "runway_months": 3,
    "monthly_income": 0,
    "monthly_expenses": 0,
    "money_delta": 0
  },
  "skills": {
    "utilization_pct": 98,
    "active_learning": false,
    "mastery_count": 0,
    "growth_count": 24
  },
  "network": {
    "collaboration_score": 60,
    "active_relationships": 0,
    "outreach_this_week": 0
  },
  "life_phase": 1
}